110,"Assumenda labore ratione.","Sed in totam non quas quibusdam assumenda illum qui dolores eveniet reprehenderit fugiat cumque amet inventore ipsa vel deleniti accusamus et sunt corrupti quidem nihil ut incidunt quia qui consequatur occaecati occaecati harum qui animi voluptatibus pariatur tempore quia enim ducimus harum laborum omnis nobis laborum animi consequatur voluptatem animi eum labore mollitia at autem odio totam consequuntur in cupiditate incidunt perspiciatis et est tempore similique error commodi eos rerum sed aliquid totam dolor aut nobis quia ut natus necessitatibus labore voluptas omnis qui eum aspernatur est fuga et consequatur aut est minus quia reiciendis voluptas odit aliquid.",84,assumenda-labore-ratione,03/03/2022
111,"Ipsa ex in.","Nostrum aut aut eos odit ullam et fugit officiis et ducimus voluptatibus ut veniam adipisci neque eaque maiores accusantium reprehenderit magnam minima nam eos optio delectus facere perferendis voluptatum recusandae numquam ut deleniti qui eius deleniti illo et et repellendus vel consequuntur tempora consequatur quas ut totam voluptas quibusdam atque consequatur enim velit perferendis quis vel quasi in qui dolores optio adipisci quos voluptatum deleniti repellendus tempore qui sequi atque laborum natus iusto reiciendis facere neque velit suscipit quo assumenda quia dolores voluptates cumque repudiandae labore officia culpa sunt sunt repellendus consequatur.",292,ipsa-ex-in,03/03/2022
112,"Nostrum enim quibusdam.","Ducimus qui animi mollitia ducimus magni consequatur quia dolor sequi quia voluptatem deleniti qui et saepe quo quas quia explicabo accusamus voluptas molestiae eveniet qui omnis voluptate nemo quo aut nobis voluptate in qui facilis voluptatibus reiciendis rem possimus aspernatur magni repellat sapiente doloremque est perferendis ut odio et animi qui beatae repellat sint sunt dicta nihil vitae voluptates quos voluptates praesentium aut harum eius facilis porro nam qui perspiciatis quas magnam quidem ipsum est et consequatur facere autem dolores magnam cumque omnis necessitatibus suscipit aperiam quasi nostrum quod incidunt aliquam delectus et voluptatibus nam suscipit adipisci ut reprehenderit aut voluptatem non ut minima earum nesciunt ad dolorem voluptas fugit eaque amet officiis corporis voluptas nam ad aspernatur sapiente quia laudantium accusantium voluptatem ab soluta libero magnam omnis ipsam debitis quidem cumque quaerat autem possimus quo illo perspiciatis aut aut et vero iste nostrum libero in architecto molestiae consequuntur cumque quia eligendi et voluptatem eaque eius aperiam.",95,nostrum-enim-quibusdam,03/03/2022
113,"Ad minima quia.","Repellendus magnam eos excepturi porro et et quia rem est et officiis qui quo odit odit est quaerat vitae itaque tempora consequatur fuga ut blanditiis minima ut accusantium facilis ea tempora ullam rem delectus quisquam natus ut velit repudiandae voluptatibus nihil modi consequatur omnis laudantium nulla dolorem et porro assumenda rerum sint debitis et iure molestiae distinctio laborum autem saepe eaque rerum quisquam facere sit non unde atque ut molestiae non suscipit dolore et porro veritatis earum ut vitae velit consectetur alias ipsam error repellendus sunt enim enim occaecati ad nihil et molestiae temporibus repellendus sed sit ullam voluptatem est voluptatem et quibusdam incidunt omnis eligendi et a explicabo voluptas voluptas perferendis voluptas non quidem perferendis repellat amet saepe fuga ut aut molestiae quo aliquid magni debitis omnis ad nemo aut voluptatibus corrupti similique fugiat autem suscipit amet culpa aut rem quidem tempora odit et omnis eaque tempora numquam eum quidem consequatur aut vel et maxime omnis maxime est non molestias iusto.",210,ad-minima-quia,03/03/2022
114,"Veniam consectetur.","Non cupiditate laboriosam a ex fuga aut voluptatem quibusdam cum dolorem possimus harum quibusdam facere nobis fugit quia quos temporibus laborum iure dicta distinctio ut fuga ad aut ut dolorem tempore nobis quis quia magnam et velit sed ut quidem ut veniam velit omnis nihil reprehenderit omnis qui pariatur nemo et non voluptas sint enim sunt voluptatem incidunt fugiat delectus reprehenderit quis fugiat impedit dolorum sequi nostrum ut rerum ipsum nisi quidem cupiditate est velit atque sit iusto corrupti ipsa odit quia in esse qui animi et magni corporis aut tenetur et officiis quia vel at totam autem repellendus sed velit aut placeat sit culpa unde quos magnam quis enim sunt eos aliquam molestias perspiciatis natus deleniti consequatur occaecati ullam in illum totam sint provident et tempora amet laboriosam exercitationem distinctio sit omnis sed qui vel voluptas id id quidem est qui vel quibusdam totam sunt dolorem esse debitis quis odio quia quis optio alias omnis cupiditate.",53,veniam-consectetur,03/03/2022
115,"Voluptatem hic perspiciatis.","Eos omnis ut laboriosam vel vel delectus ut totam facere dignissimos ea ad velit exercitationem est ut est ratione autem libero ipsam voluptatum quas eos doloremque recusandae ipsum consectetur praesentium nam corrupti dolor rem consequatur et eius voluptatem sunt dolorum ipsa eum assumenda nostrum qui qui ut suscipit deserunt distinctio quas ut officia rem illo omnis officia voluptas dolor sed molestias iure aliquam sequi sint aut rem eligendi sunt illum praesentium consectetur minima deserunt itaque nisi veritatis veniam repellat maxime velit nostrum tenetur expedita rem hic asperiores odit eos quia ut quos molestiae laboriosam velit at minima voluptas laudantium ut sed accusantium veniam magnam voluptatem repellat qui accusamus nobis illo itaque rem nemo quam totam odio est dolores aperiam ad cumque laudantium consequatur quos enim deserunt consectetur quidem necessitatibus autem ex architecto impedit vitae quis facilis ab tempore illum non suscipit sed est sit nulla libero doloremque voluptatem occaecati consequatur dolor quis magnam facere.",267,voluptatem-hic-perspiciatis,03/03/2022
116,"Illo sed placeat.","Amet ut exercitationem sed voluptatem aspernatur magnam nostrum nisi quibusdam explicabo et voluptas alias repellat dolore doloribus expedita ipsa aut asperiores totam molestias ut et est quae mollitia et voluptas eveniet eum impedit amet voluptatum eligendi illo numquam nihil dolores ducimus omnis magnam quos dolore voluptas non ea explicabo corporis est et maxime sunt libero adipisci non et natus perspiciatis voluptatem non qui consequatur facilis adipisci quos et totam autem quidem rerum vel consequatur exercitationem autem rem omnis placeat possimus dicta exercitationem quam eos ipsam dignissimos animi et ut sit doloremque numquam quibusdam voluptas rerum illo ad repudiandae repudiandae dolorem architecto sequi eligendi sunt eligendi aliquid nam qui quo ex aut velit voluptatum unde voluptatem dolorem qui nostrum eos optio animi cupiditate accusamus quibusdam sit et qui soluta adipisci qui quia quidem tenetur explicabo aperiam et voluptas aliquid voluptatem quia non iste illo ex quia sequi adipisci eveniet in cumque voluptas quis et voluptatem et saepe incidunt maxime suscipit atque excepturi officia tenetur ut iste similique ut odio saepe non hic fuga nam non.",103,illo-sed-placeat,03/03/2022
117,"Omnis totam.","Similique mollitia et rerum modi consequatur suscipit ipsum quis amet dignissimos iste ipsam exercitationem eligendi explicabo quaerat dolores quasi iure culpa nihil aliquam esse autem necessitatibus repellat libero sed dicta velit occaecati quos assumenda et nesciunt dolor in unde doloribus corrupti repellat quaerat sunt est sit quibusdam quae qui mollitia itaque excepturi optio doloremque in sit nulla nulla iure at doloribus nam nemo illo aut accusantium nobis saepe eos repellendus est veniam rem dolores ratione corporis dolorem officia libero mollitia assumenda sed illo quae eligendi dolor alias dicta id qui ea sit beatae fugiat vitae neque est earum et et dolorem molestias error voluptatum suscipit et dolorem voluptates quibusdam delectus voluptatem perferendis rerum est sed aut quia sequi sunt ab consectetur non dolorem similique qui non quo blanditiis odio incidunt dolores sequi eos est facere nulla nihil omnis nobis laborum doloremque numquam culpa omnis dolorum iusto aut tempora impedit illum ea ducimus.",18,omnis-totam,03/03/2022
118,"Nobis quaerat.","Aut ipsa odit suscipit necessitatibus qui omnis ipsa maxime sapiente blanditiis perspiciatis in id at voluptatem quia suscipit dignissimos reiciendis quia consequatur laborum reprehenderit assumenda rerum sed laudantium nemo accusantium corporis similique aut perferendis unde ullam animi doloremque quod in saepe voluptatibus omnis natus ab aut soluta repudiandae aut ut fugit voluptas nobis ea quod dolor doloribus rerum beatae id laborum quia reiciendis odio voluptas minima sit quisquam nihil laudantium at ab aut ea voluptatibus consequatur magni debitis enim sed praesentium facere illo.",103,nobis-quaerat,03/03/2022
119,"Omnis sit.","Dolor minima eum culpa consequatur distinctio recusandae quis dignissimos error quae non est ea ab sint architecto eum hic culpa facere voluptatem quis saepe et voluptatem mollitia vel rerum recusandae autem nostrum porro unde accusamus delectus expedita velit ut quas consequatur quia odit nesciunt iste molestiae eligendi voluptatibus optio voluptatem et porro labore temporibus consequuntur et praesentium aut architecto ea unde quia accusantium nihil architecto quidem dolores repellendus sed in fugit voluptate ipsam sunt reprehenderit voluptas eligendi praesentium incidunt sunt saepe ut quisquam nulla saepe dolores deleniti ducimus molestiae vel facilis beatae sint esse corrupti eveniet deleniti iusto eum exercitationem dolor consectetur vel aut autem aut saepe corporis atque fugit repudiandae veniam deleniti.",191,omnis-sit,03/03/2022
120,"Mollitia molestiae modi.","Et quisquam nihil asperiores labore occaecati dolorum ut in tempora voluptatum sint distinctio porro maiores exercitationem eaque dolor non porro repellendus et dolorum non distinctio quae doloribus culpa totam rerum fugiat repudiandae cupiditate voluptatibus quo distinctio placeat distinctio suscipit pariatur voluptas aut aut quo assumenda unde dolor rerum ducimus aut dignissimos veritatis exercitationem qui nisi ut voluptatem vitae minus quia velit quo repudiandae sunt deserunt sunt sint et repellendus voluptatem eum nostrum iusto voluptas vero unde enim quod deleniti ea nisi sed vitae qui cupiditate molestiae quia rem nihil aliquid omnis tempore possimus voluptatem consequatur ut quibusdam id sed aut aut vel veritatis expedita iste aperiam temporibus molestiae et qui facere dolor blanditiis eligendi velit veritatis dicta sit occaecati placeat voluptatem voluptates pariatur qui et vero esse qui nobis deserunt velit minima similique est doloribus quod rerum quam consequatur dolores id cumque amet eveniet minima voluptatem at illo quos odit explicabo veniam perferendis voluptas aut vitae voluptas aliquam fuga sit dignissimos in.",207,mollitia-molestiae-modi,03/03/2022
121,"Accusantium est mollitia.","Dolores et qui porro ad suscipit id dolores aut expedita delectus est repellendus facere dignissimos rerum adipisci qui autem autem atque cupiditate sunt et quo aliquam eaque modi aut id possimus voluptates distinctio et aliquam est voluptas doloribus sit ut amet iure distinctio molestias beatae molestias sit aut autem accusantium a ut corporis voluptatem sunt veniam voluptas ipsum veniam dolorem commodi maxime laborum illum illum sint qui ut eligendi qui quia ut animi aut omnis pariatur at incidunt nesciunt vel vel omnis assumenda est dolorem fugiat assumenda est qui.",36,accusantium-est-mollitia,03/03/2022
